{"approval_metadata":null,"content_hash":"7cb1c2c344a5406af1f352d11e65f25736afadfa788a20525159a3acc5ef4377","correction_lineage":null,"coverage_complete":false,"coverage_end":"2026-10-14","coverage_manifest":{"excluded":[{"reason":"Outside the explicit Phase 1 free-sample allowlist","source_id":"0f69aa20-2a64-42dd-b43e-dd58acb38d72"},{"reason":"Outside the explicit Phase 1 free-sample allowlist","source_id":"54b8a224-7dbb-43c8-8441-7e9d21712cb5"},{"reason":"Outside the explicit Phase 1 free-sample allowlist","source_id":"1a39acda-7e0c-497c-8703-0967d41f94f6"}],"included":["bcadb490-b39a-4f11-befd-fa8e15bf480b"],"legacy_without_manuscript":[],"missing_publication_dates":["2026-10-01","2026-10-02","2026-10-03","2026-10-04","2026-10-05","2026-10-06","2026-10-07","2026-10-08","2026-10-09","2026-10-10","2026-10-11","2026-10-12","2026-10-13","2026-10-15"]},"coverage_start":"2026-10-14","decision_queue":[],"edition_id":"2026-10","edition_version":1,"editorial_decision_manifest":{"coverage_end":"2026-10-14","coverage_start":"2026-10-14","edition_id":"2026-10","edition_version":1,"editorial_decisions":[],"exams":["CDS","CAPF-AC","NDA","AFCAT"],"exclusions":{"0f69aa20-2a64-42dd-b43e-dd58acb38d72":"Outside the explicit Phase 1 free-sample allowlist","1a39acda-7e0c-497c-8703-0967d41f94f6":"Outside the explicit Phase 1 free-sample allowlist","54b8a224-7dbb-43c8-8441-7e9d21712cb5":"Outside the explicit Phase 1 free-sample allowlist"},"include_story_ids":["bcadb490-b39a-4f11-befd-fa8e15bf480b"],"kind":"SAMPLE","ordering":{"rule":"subject-date-source-ordinal","subjects":["International Relations"]},"sources":[{"approved_source_version":1,"edition_id":"852e10da-5c7a-4c0f-b380-67f6312cbb48","source_hash":"9c543435b083a0d0be572eaef2bfe867b6ac16f77a4192cfe476bca0023ce112"}],"taxonomy":["International Relations"],"title":"October 2026 · Free BIMSTEC sample"},"exam_inclusion":["CDS","CAPF-AC","NDA","AFCAT"],"generated_artifacts":[],"generator_version":"dp-monthly-2.0.0","kind":"SAMPLE","mcq_ids":["a7dbadbe-e1c1-4329-b582-cb4d6be4a7ee"],"ordering":{"rule":"subject-date-source-ordinal","subjects":["International Relations"]},"release_metadata":null,"schema_version":1,"source_as_of":"2026-10-15","source_edition_ids":["852e10da-5c7a-4c0f-b380-67f6312cbb48"],"source_hashes":[{"approved_source_version":1,"edition_id":"852e10da-5c7a-4c0f-b380-67f6312cbb48","source_hash":"9c543435b083a0d0be572eaef2bfe867b6ac16f77a4192cfe476bca0023ce112"}],"status":"VALIDATED","stories":[{"approved_source_hash":"9c543435b083a0d0be572eaef2bfe867b6ac16f77a4192cfe476bca0023ce112","content":{"dpScore":94,"editorialMarkdown":"## What Happened?\n\nThe **first BIMSTEC Home Ministers’ Meeting**, held in **New Delhi on 13 October 2026**, concluded with the adoption of the **Delhi Declaration**. This is a substantive update to the previous day's announcement that India would host the meeting: the outcome is now confirmed by the Ministry of Home Affairs.\n\nThe seven participating countries reaffirmed cooperation against terrorism, transnational organised crime, illicit drug trafficking, cybercrime, human trafficking and money laundering. The Declaration also addressed the exploitation of trafficked persons in online scam operations. It urged effective implementation of existing cooperation instruments and called for further work on proposed conventions and information-sharing arrangements.\n\n## Why It Matters\n\nCross-border terrorism, trafficking and online fraud demand **mutual legal assistance, intelligence cooperation and coordinated capacity-building**.\n\nFor CAPF-AC, this links diplomacy with internal security; for CDS/NDA, membership and institutions remain high-yield. **A declaration is not a ratified treaty.**\n\n## Key Exam Facts\n\n1. **BIMSTEC** stands for Bay of Bengal Initiative for Multi-Sectoral Technical and Economic Cooperation.\n2. **Seven members:** Bangladesh, Bhutan, India, Myanmar, Nepal, Sri Lanka and Thailand; its Secretariat is in **Dhaka**.\n3. **Meeting:** First BIMSTEC Home Ministers’ Meeting, **13 October 2026**, **New Delhi**; outcome: **Delhi Declaration**.\n4. **India leads BIMSTEC's Security sector**, including counter-terrorism and transnational crime, disaster management and energy.\n5. The **BIMSTEC Convention on Combating International Terrorism, Transnational Organised Crime and Illicit Drug Trafficking** entered into force in **March 2021**, according to the Declaration.\n6. The **Convention on Mutual Legal Assistance in Criminal Matters** was **signed in March 2022**; the Declaration calls for effective implementation.\n7. Texts on **extradition, transfer of sentenced persons and trafficking in persons** were identified for early finalisation; do **not** report them as already concluded.\n8. The declaration references UN Security Council sanctions, including the **1267 Sanctions Committee**, and cooperation with international bodies such as UNODC, INTERPOL and FATF.\n\n## Static–Current Linkage\n\n**Mutual legal assistance** helps authorities in one jurisdiction obtain evidence or other lawful cooperation from another. **Extradition** concerns surrendering an individual to another state for prosecution or punishment under applicable law. **Anti-money laundering** aims to prevent criminal proceeds from entering or circulating through the financial system.\n\nThese are related but distinct mechanisms. BIMSTEC's seven-country geography links the Bay of Bengal with South and Southeast Asia; it should not be confused with SAARC or ASEAN. Pakistan is **not** a BIMSTEC member.\n\n## Exam Edge\n\n**Most testable distinction:** The **2021 terrorism/transnational-crime convention is in force**, the **2022 mutual-legal-assistance convention was signed**, and the proposed **extradition/trafficking conventions are still to be finalised**. Do not turn a declaration's recommendation into a completed legal agreement.\n\n**Exact PYQ evidence:** CDS I 2026 GK Q99 tests BIMSTEC's institutional facts, while CAPF 2022 Paper I Q125 tests membership. The 14 October edition links these canonical eligible questions directly below the story.\n\n## Future Question Angles\n\nA statement-based question may ask which BIMSTEC security instruments are already in force, which were signed, and which remain proposals. Other likely angles: membership, India's Security-sector leadership, the Dhaka Secretariat, transnational organised crime, and why cross-border cyber-fraud requires regional cooperation.\n\n**Official source (13 October 2026, 20:03 IST):** [Ministry of Home Affairs / PIB](https://www.pib.gov.in/PressReleseDetailm.aspx?PRID=2322964&lang=1&reg=3).","examTags":["CDS","CAPF-AC","NDA","AFCAT"],"futureAngle":"Legal status of instruments; seven members; India Security-sector lead; transnational crime.","headline":"First BIMSTEC Home Ministers’ Meeting Adopts Delhi Declaration","keyFacts":["Delhi Declaration adopted on 13 October in New Delhi.","Seven members; Secretariat in Dhaka; India leads Security.","2021 convention in force; 2022 mutual legal assistance signed; further texts proposed."],"keywords":["BIMSTEC","Delhi Declaration","mutual legal assistance","terrorism","transnational crime"],"linkedPyqIds":["CDS_I_2026_GK_099","CAPF_2022_P1_125"],"mcqs":[{"contentStatus":"VERIFIED","correctOption":"A","difficulty":"Hard","examEdge":"Distinguish adopted declarations, signed conventions, conventions in force and proposals awaiting finalisation.","examTags":["CDS","CAPF-AC","NDA","AFCAT"],"explanation":"Statements 1 and 2 are correct. The first Home Ministers’ Meeting was held in New Delhi on 13 October 2026 and the Declaration identifies the counter-terrorism/transnational-crime convention as in force since March 2021. It calls for early finalisation of the extradition convention; it does not say that convention is already in force.","mockEligible":false,"options":{"A":"1 and 2 only","B":"2 and 3 only","C":"1 and 3 only","D":"1, 2 and 3"},"question":"With reference to the Delhi Declaration adopted at the first BIMSTEC Home Ministers’ Meeting in October 2026, consider the following statements: 1. The meeting took place in New Delhi. 2. The BIMSTEC Convention on Combating International Terrorism, Transnational Organised Crime and Illicit Drug Trafficking entered into force in March 2021. 3. The Declaration stated that a new BIMSTEC extradition convention had already entered into force. Which statements are correct?","questionType":"Three-statement combination","sourceUrl":"https://www.pib.gov.in/PressReleseDetailm.aspx?PRID=2322964&lang=1&reg=3","subject":"International Relations","topic":"Regional Organisations"}],"sourceDate":"2026-10-13","sourceName":"Ministry of Home Affairs / Press Information Bureau","sourceUrl":"https://www.pib.gov.in/PressReleseDetailm.aspx?PRID=2322964&lang=1&reg=3","staticLink":"Regional counter-terrorism, trafficking and legal-assistance cooperation has concrete institutional implications.","subject":"International Relations","subtopic":"BIMSTEC Security Cooperation","topic":"Regional Organisations","whatHappened":"New Delhi hosted the first BIMSTEC Home Ministers’ Meeting, which adopted the Delhi Declaration on 13 October 2026.","whyItMatters":"Regional counter-terrorism, trafficking and legal-assistance cooperation has concrete institutional implications."},"exam_tags":["CDS","CAPF-AC","NDA","AFCAT"],"linked_pyqs":[{"checked_as_of":"2026-10-15","content_status":"UNCHECKED","eligible":true,"id":"CDS_I_2026_GK_099"},{"checked_as_of":"2026-10-15","content_status":"UNCHECKED","eligible":true,"id":"CAPF_2022_P1_125"}],"mcqs":[{"content":{"contentStatus":"VERIFIED","correctOption":"A","difficulty":"Hard","examEdge":"Distinguish adopted declarations, signed conventions, conventions in force and proposals awaiting finalisation.","examTags":["CDS","CAPF-AC","NDA","AFCAT"],"explanation":"Statements 1 and 2 are correct. The first Home Ministers’ Meeting was held in New Delhi on 13 October 2026 and the Declaration identifies the counter